{
  "schemaVersion": 1,
  "matchday": {
    "club": {
      "id": "aurora-fc",
      "name": "Aurora Futebol Clube",
      "shortName": "AUR",
      "city": "Porto Claro",
      "primaryColor": "#35c88a",
      "countryCode": "BRA",
      "competitionName": "Liga Horizonte",
      "stadiumName": null
    },
    "opponent": {
      "id": "ferroviario-do-vale",
      "name": "Ferroviário do Vale",
      "shortName": "FDV",
      "city": "Vale do Norte",
      "primaryColor": "#d18a42",
      "countryCode": "BRA",
      "competitionName": "Liga Horizonte",
      "stadiumName": null
    },
    "round": 1,
    "players": [
      {
        "id": "rv-01",
        "name": "Caio Brandão",
        "shortName": "C. Brandão",
        "shirtNumber": 1,
        "position": "GK",
        "age": 27,
        "nationality": "BRA",
        "heightCm": 190,
        "preferredFoot": "right",
        "squadRole": "firstTeam",
        "rating": 76,
        "potentialRating": 76,
        "matchFitness": 92,
        "morale": 78,
        "condition": 96,
        "appearances": 16,
        "goals": 0,
        "assists": 0,
        "averageRating": 7.18,
        "selected": true
      },
      {
        "id": "rv-02",
        "name": "Davi Moura",
        "shortName": "D. Moura",
        "shirtNumber": 22,
        "position": "RB",
        "age": 24,
        "nationality": "BRA",
        "heightCm": 177,
        "preferredFoot": "right",
        "squadRole": "firstTeam",
        "rating": 73,
        "potentialRating": 76,
        "matchFitness": 88,
        "morale": 74,
        "condition": 92,
        "appearances": 14,
        "goals": 0,
        "assists": 3,
        "averageRating": 6.91,
        "selected": true
      },
      {
        "id": "rv-03",
        "name": "Iago Serpa",
        "shortName": "I. Serpa",
        "shirtNumber": 3,
        "position": "CB",
        "age": 29,
        "nationality": "BRA",
        "heightCm": 188,
        "preferredFoot": "right",
        "squadRole": "keyPlayer",
        "rating": 78,
        "potentialRating": 78,
        "matchFitness": 91,
        "morale": 82,
        "condition": 89,
        "appearances": 16,
        "goals": 1,
        "assists": 0,
        "averageRating": 7.24,
        "selected": true
      },
      {
        "id": "rv-04",
        "name": "Breno Vidal",
        "shortName": "B. Vidal",
        "shirtNumber": 4,
        "position": "CB",
        "age": 25,
        "nationality": "BRA",
        "heightCm": 186,
        "preferredFoot": "right",
        "squadRole": "firstTeam",
        "rating": 75,
        "potentialRating": 78,
        "matchFitness": 94,
        "morale": 79,
        "condition": 94,
        "appearances": 15,
        "goals": 0,
        "assists": 1,
        "averageRating": 7.08,
        "selected": true
      },
      {
        "id": "rv-05",
        "name": "Nilo Azevedo",
        "shortName": "N. Azevedo",
        "shirtNumber": 16,
        "position": "LB",
        "age": 22,
        "nationality": "BRA",
        "heightCm": 175,
        "preferredFoot": "left",
        "squadRole": "firstTeam",
        "rating": 74,
        "potentialRating": 82,
        "matchFitness": 96,
        "morale": 86,
        "condition": 97,
        "appearances": 15,
        "goals": 1,
        "assists": 4,
        "averageRating": 7.32,
        "selected": true
      },
      {
        "id": "rv-06",
        "name": "Tomás Paiva",
        "shortName": "T. Paiva",
        "shirtNumber": 5,
        "position": "DM",
        "age": 28,
        "nationality": "URU",
        "heightCm": 184,
        "preferredFoot": "right",
        "squadRole": "keyPlayer",
        "rating": 79,
        "potentialRating": 79,
        "matchFitness": 90,
        "morale": 84,
        "condition": 91,
        "appearances": 16,
        "goals": 2,
        "assists": 2,
        "averageRating": 7.41,
        "selected": true
      },
      {
        "id": "rv-07",
        "name": "Luan Seixas",
        "shortName": "L. Seixas",
        "shirtNumber": 8,
        "position": "CM",
        "age": 23,
        "nationality": "BRA",
        "heightCm": 181,
        "preferredFoot": "right",
        "squadRole": "firstTeam",
        "rating": 77,
        "potentialRating": 84,
        "matchFitness": 95,
        "morale": 88,
        "condition": 95,
        "appearances": 15,
        "goals": 3,
        "assists": 5,
        "averageRating": 7.36,
        "selected": true
      },
      {
        "id": "rv-08",
        "name": "Ravi Monteiro",
        "shortName": "R. Monteiro",
        "shirtNumber": 10,
        "position": "CM",
        "age": 26,
        "nationality": "BRA",
        "heightCm": 178,
        "preferredFoot": "left",
        "squadRole": "firstTeam",
        "rating": 76,
        "potentialRating": 79,
        "matchFitness": 87,
        "morale": 76,
        "condition": 90,
        "appearances": 13,
        "goals": 2,
        "assists": 6,
        "averageRating": 7.12,
        "selected": true
      },
      {
        "id": "rv-09",
        "name": "Enzo Falcão",
        "shortName": "E. Falcão",
        "shirtNumber": 7,
        "position": "RW",
        "age": 21,
        "nationality": "BRA",
        "heightCm": 174,
        "preferredFoot": "left",
        "squadRole": "keyPlayer",
        "rating": 78,
        "potentialRating": 86,
        "matchFitness": 97,
        "morale": 91,
        "condition": 98,
        "appearances": 16,
        "goals": 6,
        "assists": 7,
        "averageRating": 7.62,
        "selected": true
      },
      {
        "id": "rv-10",
        "name": "Murilo Braga",
        "shortName": "M. Braga",
        "shirtNumber": 9,
        "position": "ST",
        "age": 27,
        "nationality": "BRA",
        "heightCm": 187,
        "preferredFoot": "right",
        "squadRole": "keyPlayer",
        "rating": 81,
        "potentialRating": 82,
        "matchFitness": 93,
        "morale": 89,
        "condition": 93,
        "appearances": 16,
        "goals": 11,
        "assists": 2,
        "averageRating": 7.71,
        "selected": true
      },
      {
        "id": "rv-11",
        "name": "Noah Teles",
        "shortName": "N. Teles",
        "shirtNumber": 11,
        "position": "LW",
        "age": 24,
        "nationality": "BRA",
        "heightCm": 176,
        "preferredFoot": "right",
        "squadRole": "firstTeam",
        "rating": 77,
        "potentialRating": 82,
        "matchFitness": 94,
        "morale": 85,
        "condition": 96,
        "appearances": 15,
        "goals": 5,
        "assists": 5,
        "averageRating": 7.38,
        "selected": true
      },
      {
        "id": "rv-12",
        "name": "Ícaro Reis",
        "shortName": "Í. Reis",
        "shirtNumber": 12,
        "position": "GK",
        "age": 20,
        "nationality": "BRA",
        "heightCm": 193,
        "preferredFoot": "right",
        "squadRole": "prospect",
        "rating": 68,
        "potentialRating": 81,
        "matchFitness": 83,
        "morale": 72,
        "condition": 100,
        "appearances": 2,
        "goals": 0,
        "assists": 0,
        "averageRating": 6.88,
        "selected": false
      },
      {
        "id": "rv-13",
        "name": "Otávio Luz",
        "shortName": "O. Luz",
        "shirtNumber": 14,
        "position": "CB",
        "age": 31,
        "nationality": "BRA",
        "heightCm": 190,
        "preferredFoot": "right",
        "squadRole": "backup",
        "rating": 72,
        "potentialRating": 72,
        "matchFitness": 78,
        "morale": 68,
        "condition": 87,
        "appearances": 5,
        "goals": 0,
        "assists": 0,
        "averageRating": 6.72,
        "selected": false
      },
      {
        "id": "rv-14",
        "name": "Pietro Nunes",
        "shortName": "P. Nunes",
        "shirtNumber": 27,
        "position": "CM",
        "age": 19,
        "nationality": "BRA",
        "heightCm": 179,
        "preferredFoot": "right",
        "squadRole": "prospect",
        "rating": 71,
        "potentialRating": 86,
        "matchFitness": 89,
        "morale": 81,
        "condition": 100,
        "appearances": 7,
        "goals": 1,
        "assists": 2,
        "averageRating": 7.03,
        "selected": false
      },
      {
        "id": "rv-15",
        "name": "Gael Ramos",
        "shortName": "G. Ramos",
        "shirtNumber": 20,
        "position": "AM",
        "age": 22,
        "nationality": "ARG",
        "heightCm": 176,
        "preferredFoot": "left",
        "squadRole": "rotation",
        "rating": 74,
        "potentialRating": 83,
        "matchFitness": 90,
        "morale": 83,
        "condition": 97,
        "appearances": 10,
        "goals": 3,
        "assists": 3,
        "averageRating": 7.15,
        "selected": false
      },
      {
        "id": "rv-16",
        "name": "Theo Barros",
        "shortName": "T. Barros",
        "shirtNumber": 17,
        "position": "RW",
        "age": 25,
        "nationality": "POR",
        "heightCm": 172,
        "preferredFoot": "right",
        "squadRole": "rotation",
        "rating": 73,
        "potentialRating": 75,
        "matchFitness": 86,
        "morale": 73,
        "condition": 94,
        "appearances": 9,
        "goals": 2,
        "assists": 2,
        "averageRating": 6.89,
        "selected": false
      },
      {
        "id": "rv-17",
        "name": "Samuel Lins",
        "shortName": "S. Lins",
        "shirtNumber": 19,
        "position": "ST",
        "age": 30,
        "nationality": "BRA",
        "heightCm": 185,
        "preferredFoot": "right",
        "squadRole": "rotation",
        "rating": 75,
        "potentialRating": 75,
        "matchFitness": 76,
        "morale": 65,
        "condition": 86,
        "appearances": 8,
        "goals": 4,
        "assists": 1,
        "averageRating": 6.96,
        "selected": false